Name,Role,Alignment,Dialogue
Buzzy,Accountant,Good,"Let's go over the numbers and make sure everything adds up."
Maya Buzzwell,HR Specialist,Good,"We want to make sure every bee feels valued and heard."
Walter Wing,Office Manager,Good,"I’ll check in with the team and see how they’re doing."
Ruby Honeycomb,Secretary,Good,"I’ll send the report to you by the end of the day."
Oscar Pollen,Operations Lead,Good,"We can improve our workflow with small adjustments."
Greg Nectar,IT Support,Good,"I’ll check your system and see what’s causing the issue."
Philip Stinger,Marketing Analyst,Good,"Our ad campaign is getting positive responses!"
Buzzford,Senior Consultant,Bad,"Let’s circle back on this after our standup."
Taylor Beezly,CEO,Bad,"We need to disrupt the industry with next-gen solutions."
Jordan Hivewell,Marketing Director,Bad,"We’re pivoting towards an omnichannel strategy."
Cameron Comb,Agile Coach,Bad,"Let’s double-click on the KPIs before we move forward."
Pat Dronefield,HR Business Partner,Bad,"We want to harmonize company culture and innovation."
Morgan Waxley,Tech Evangelist,Bad,"We need to supercharge our digital transformation."
Alex Buzzington,Corporate Strategist,Bad,"Let's leverage synergy and take this offline."
Jamie Honeywell,Brand Manager,Bad,"This campaign will move the needle for brand awareness."
Beeatrice Swarm,Legal Advisor,Good,"Let’s make sure this contract is clear and fair."
Pollen Peterson,Receptionist,Good,"Let me connect you to the right department."
Zippy Sting,Product Manager,Good,"We should focus on making our service easier to use."
Benedict Buzz,Customer Relations,Good,"Customer satisfaction is what drives our success."
Flora Wingfield,Sales Lead,Good,"Honest communication with customers builds trust."
Hector Hive,Procurement Officer,Good,"I’ll negotiate the best price for quality materials."
Victor Waggledance,Security Officer,Good,"Keeping the office safe is my top priority."
Honeydew Swarm,Finance Lead,Good,"Let’s ensure everyone gets paid on time."
Amber Nectar,Event Planner,Good,"I’ll organize everything to make this event smooth."
Roger Beely,IT Technician,Good,"Fixing the server issue is my top priority."
Sophie Pollenwell,Graphic Designer,Good,"Our visuals should be clean and effective."
Tim Swarmson,Administrative Assistant,Good,"Let me help organize your schedule."
Daphne Buzzard,Legal Compliance,Good,"We need to adhere strictly to the guidelines."
Stanley Stinger,Auditor,Good,"Let’s ensure everything is transparent and compliant."
Buzz Lightwing,Consultant,Bad,"We need to innovate at scale and disrupt the market."
Hugh Honeycomb,Operations Manager,Bad,"Let’s optimize our workflow for synergy."
Winnie Wingfield,Sales Executive,Bad,"We should drill down into the core value proposition."
Nadia Nectar,Finance Advisor,Bad,"We have to optimize our growth vectors and track record."
Charlie Combster,VP of Sales,Bad,"Let’s gamify the engagement strategy."
Melanie Bumble,Project Coordinator,Bad,"Let’s align on the paradigm shift."
Lance Larva,Strategy Consultant,Bad,"Our low-hanging fruit is digital transformation."
Ella Waxley,Head of Partnerships,Bad,"We need to engage stakeholders more effectively."
Derek Droneson,VP of Growth,Bad,"We’re scaling fast to achieve synergy."
Martha Honeygale,Chief Innovation Officer,Bad,"We should evangelize our agile approach."
Ivan Buzzard,Corporate Speaker,Bad,"We’re in a holding pattern until we optimize workflows."
Natalie Stingerly,Tech Startup Founder,Bad,"Let’s push the envelope on thought leadership."
Brent Beewell,HR Coordinator,Bad,"We must socialize our reorganization plans."
Julia Swarmson,Digital Strategy Manager,Bad,"A deep dive into best-of-breed solutions is key."
Thomas Wingate,Customer Experience Lead,Bad,"A quick win would be harmonizing our tech stack."
Brianna Bumbles,Scrum Master,Bad,"Let’s keep everyone in the loop to optimize engagement."
Gordon Hiveley,Corporate Trainer,Bad,"Scaling our operational efficiency is a game changer."
Felicity Fuzz,Networking Specialist,Bad,"We need to be in sync with the new normal."